{"$schema":"https://json-schema.org/draft/2020-12/schema","title":"Account Profile V1","type":"object","additionalProperties":false,"required":["schema_version","profile_id","display_name","positioning","audience","content_directions","voice","synthetic"],"properties":{"schema_version":{"const":"1.0.0"},"profile_id":{"type":"string","minLength":1},"display_name":{"type":"string"},"positioning":{"type":"string","minLength":1},"audience":{"type":"object","required":["description"],"properties":{"description":{"type":"string"},"needs":{"type":"array","items":{"type":"string"}}}},"content_directions":{"type":"array","items":{"type":"string"}},"voice":{"type":"object","required":["traits","avoid"],"properties":{"traits":{"type":"array","items":{"type":"string"}},"avoid":{"type":"array","items":{"type":"string"}}}},"synthetic":{"type":"boolean"}}}
